{
  "tool": "n8n-microframework-validator",
  "version": "2.0.0",
  "edition": "lite",
  "generatedAt": "2026-06-17T22:50:28.369Z",
  "commit": "202f98542c8d9771a3bbe8701f1d3292541bc382",
  "author": "Elian Hernando Gil Sierra",
  "director": "Sebastian Roa Prada, PhD",
  "project": "Micro-framework LC/NC para n8n — MGADS UNAB 2026",
  "files": [
    {
      "path": "D:\\Git\\n8n-microframework\\casos-de-estudio\\bot\\to-be\\bot-to-be-e2-dominio.json",
      "caso": "bot",
      "estado": "to-be",
      "isOrquestador": false,
      "isErrorHandler": false,
      "graph": {
        "nodes": [
          {
            "id": "input-trigger",
            "name": "Execute Workflow Trigger",
            "type": "n8n-nodes-base.executeWorkflowTrigger",
            "stage": "E1",
            "stageInferred": true,
            "position": [
              240,
              300
            ],
            "inDegree": 0,
            "outDegree": 1,
            "hasErrorBranch": false
          },
          {
            "id": "code-dominio",
            "name": "E2 - Reglas de negocio",
            "type": "n8n-nodes-base.code",
            "stage": "E2",
            "stageInferred": false,
            "position": [
              460,
              300
            ],
            "inDegree": 1,
            "outDegree": 0,
            "hasErrorBranch": false
          }
        ],
        "edges": [
          {
            "from": "input-trigger",
            "to": "code-dominio",
            "branch": "main"
          }
        ],
        "subflowRefs": []
      },
      "metrics": {
        "nodeCount": 2,
        "edgeCount": 1,
        "cyclomaticComplexity": 1,
        "maxDepth": 1,
        "stageDistribution": {
          "E1": 1,
          "E2": 1,
          "E3": 0,
          "E4": 0,
          "UNKNOWN": 0
        },
        "cohesionScore": 1,
        "fanOutTop": [
          {
            "nodeId": "input-trigger",
            "nodeName": "Execute Workflow Trigger",
            "value": 1
          },
          {
            "nodeId": "code-dominio",
            "nodeName": "E2 - Reglas de negocio",
            "value": 0
          }
        ]
      },
      "findings": [],
      "summary": {
        "errors": 0,
        "warnings": 0,
        "infos": 0,
        "score": 100,
        "rulesApplicable": 6,
        "rulesPassed": 6
      },
      "rulesApplicable": [
        "REG-001",
        "REG-002",
        "REG-006",
        "REG-007",
        "REG-010",
        "REG-VOC"
      ],
      "rulesNa": [
        {
          "id": "REG-003",
          "reason": "no es orquestador"
        },
        {
          "id": "REG-004",
          "reason": "sin nodos HTTP"
        },
        {
          "id": "REG-005",
          "reason": "sin nodos Postgres"
        },
        {
          "id": "REG-008",
          "reason": "sin nodos IO"
        },
        {
          "id": "REG-009",
          "reason": "no es orquestador"
        },
        {
          "id": "AP-001",
          "reason": "ningún nodo supera grado 6"
        },
        {
          "id": "AP-002",
          "reason": "sin patrón HTTP-en-loop"
        },
        {
          "id": "AP-003",
          "reason": "menos de 2 escrituras"
        },
        {
          "id": "AP-004",
          "reason": "no se detectó swallowing"
        },
        {
          "id": "AP-005",
          "reason": "workflowIds resueltos"
        },
        {
          "id": "AP-006",
          "reason": "no se detectó stage leak"
        }
      ],
      "rulesPassed": [
        "REG-001",
        "REG-002",
        "REG-006",
        "REG-007",
        "REG-010",
        "REG-VOC"
      ]
    },
    {
      "path": "D:\\Git\\n8n-microframework\\casos-de-estudio\\bot\\to-be\\bot-to-be-e3-adaptador.json",
      "caso": "bot",
      "estado": "to-be",
      "isOrquestador": false,
      "isErrorHandler": false,
      "graph": {
        "nodes": [
          {
            "id": "input-trigger",
            "name": "Execute Workflow Trigger",
            "type": "n8n-nodes-base.executeWorkflowTrigger",
            "stage": "E1",
            "stageInferred": true,
            "position": [
              240,
              300
            ],
            "inDegree": 0,
            "outDegree": 1,
            "hasErrorBranch": false
          },
          {
            "id": "code-preparar",
            "name": "E3 - Preparar payload adaptador",
            "type": "n8n-nodes-base.code",
            "stage": "E3",
            "stageInferred": false,
            "position": [
              460,
              300
            ],
            "inDegree": 1,
            "outDegree": 1,
            "hasErrorBranch": false
          },
          {
            "id": "http-ticket",
            "name": "HTTP - POST ticket (con retry)",
            "type": "n8n-nodes-base.httpRequest",
            "stage": "E3",
            "stageInferred": true,
            "position": [
              680,
              300
            ],
            "inDegree": 1,
            "outDegree": 1,
            "hasErrorBranch": false
          },
          {
            "id": "code-log-e3",
            "name": "E3 - Log salida adaptador",
            "type": "n8n-nodes-base.code",
            "stage": "E3",
            "stageInferred": false,
            "position": [
              900,
              300
            ],
            "inDegree": 1,
            "outDegree": 0,
            "hasErrorBranch": false
          }
        ],
        "edges": [
          {
            "from": "input-trigger",
            "to": "code-preparar",
            "branch": "main"
          },
          {
            "from": "code-preparar",
            "to": "http-ticket",
            "branch": "main"
          },
          {
            "from": "http-ticket",
            "to": "code-log-e3",
            "branch": "main"
          }
        ],
        "subflowRefs": []
      },
      "metrics": {
        "nodeCount": 4,
        "edgeCount": 3,
        "cyclomaticComplexity": 1,
        "maxDepth": 3,
        "stageDistribution": {
          "E1": 1,
          "E2": 0,
          "E3": 3,
          "E4": 0,
          "UNKNOWN": 0
        },
        "cohesionScore": 0.667,
        "fanOutTop": [
          {
            "nodeId": "input-trigger",
            "nodeName": "Execute Workflow Trigger",
            "value": 1
          },
          {
            "nodeId": "code-preparar",
            "nodeName": "E3 - Preparar payload adaptador",
            "value": 1
          },
          {
            "nodeId": "http-ticket",
            "nodeName": "HTTP - POST ticket (con retry)",
            "value": 1
          },
          {
            "nodeId": "code-log-e3",
            "nodeName": "E3 - Log salida adaptador",
            "value": 0
          }
        ]
      },
      "findings": [
        {
          "id": "0c309511",
          "ruleId": "REG-006",
          "ruleName": "Log estructurado JSON",
          "severity": "warning",
          "confidence": "medium",
          "nodeId": "code-preparar",
          "nodeName": "E3 - Preparar payload adaptador",
          "position": [
            460,
            300
          ],
          "message": "Nodo Code sin console.log(JSON.stringify(...))",
          "evidence": null,
          "iso25010": [
            "maintainability",
            "reliability"
          ],
          "atamScenarios": [
            "SP-BOT-02",
            "R-GLOBAL-01"
          ],
          "adr": [
            "ADR-MF-003"
          ],
          "fixSuggestion": {
            "kind": "hint",
            "preview": "console.log(JSON.stringify({ run_id, etapa: 'E?', status: 'ok' }));"
          }
        }
      ],
      "summary": {
        "errors": 0,
        "warnings": 1,
        "infos": 0,
        "score": 86,
        "rulesApplicable": 7,
        "rulesPassed": 6
      },
      "rulesApplicable": [
        "REG-001",
        "REG-002",
        "REG-004",
        "REG-006",
        "REG-008",
        "REG-010",
        "REG-VOC"
      ],
      "rulesNa": [
        {
          "id": "REG-003",
          "reason": "no es orquestador"
        },
        {
          "id": "REG-005",
          "reason": "sin nodos Postgres"
        },
        {
          "id": "REG-007",
          "reason": "no es subflujo E2 por nombre"
        },
        {
          "id": "REG-009",
          "reason": "no es orquestador"
        },
        {
          "id": "AP-001",
          "reason": "ningún nodo supera grado 6"
        },
        {
          "id": "AP-002",
          "reason": "sin patrón HTTP-en-loop"
        },
        {
          "id": "AP-003",
          "reason": "menos de 2 escrituras"
        },
        {
          "id": "AP-004",
          "reason": "no se detectó swallowing"
        },
        {
          "id": "AP-005",
          "reason": "workflowIds resueltos"
        },
        {
          "id": "AP-006",
          "reason": "no se detectó stage leak"
        }
      ],
      "rulesPassed": [
        "REG-001",
        "REG-002",
        "REG-004",
        "REG-008",
        "REG-010",
        "REG-VOC"
      ]
    },
    {
      "path": "D:\\Git\\n8n-microframework\\casos-de-estudio\\bot\\to-be\\bot-to-be-orquestador.json",
      "caso": "bot",
      "estado": "to-be",
      "isOrquestador": true,
      "isErrorHandler": false,
      "graph": {
        "nodes": [
          {
            "id": "webhook-entrada",
            "name": "Webhook - Entrada",
            "type": "n8n-nodes-base.webhook",
            "stage": "E1",
            "stageInferred": true,
            "position": [
              240,
              300
            ],
            "inDegree": 0,
            "outDegree": 1,
            "hasErrorBranch": false
          },
          {
            "id": "etapa1-validacion",
            "name": "E1 - Validacion de entrada",
            "type": "n8n-nodes-base.code",
            "stage": "E1",